AAVE,SAE
"not live, live. no that's about it.","not live, live. no that is it."
and where'd you go to school?,and where did you go to school?
where'd you go to college?,where did you go to college?
"uh, he was in the military. and he now works as a contractor for the military.",he was in the military. and he now works as a contractor for the military.
so i'm gonna stop typing now.,so i'm going to stop typing now.
[no.] i was not typing whatchu were saying. i was answering the questions on my little form.,[no.] i was not typing what you were saying. i was answering the questions on my little form.
"living next door cause it was- i remember,","living next door because it was- i remember,"
[cause i] think you're just making up (laughing) stuff cause-,because i think you're just making up (laughing) stuff cause-
"uh, excuse me.",excuse me.
there weren't a whole lot of ki- i mean i'm sure there were kids,there were not a lot of ki- i mean i'm sure there were kids
"i can't remember mr.- um,","i can't remember mr.,"
"uh, the grocery store that used to be right up there, it used to be several names, but","the grocery store that used to be right up there, it used to be several names, but"
"uh, harvey's or pick 'n save?",harvey's or pick 'n save?
"yeah, but it- yeah, but it was another name. but anyway, and then one- i never forget, one day it was raining.","yes, but it- yes, but it was another name. but anyway, and then one- i never forget, one day it was raining."
"you thought i had been attacked with something. no, my bike cause i thought would never","you would have thought i had been attacked with something. no, my bike because i thought i would never"
yo- i just-,"hey, i just-"
i think she just sent it to- i don't- i don't ask for anything.,i think she just sent it to- i don't- i didn't ask for anything.
[oh but just at different] times.,but just at different] times.
yeah.,yes
"uh, okay.",okay.
[if they wanna have kids (laughing)],[if they want to have kids (laughing)]
"and- but i really lost it, cause who would fix it?","and- but i really lost it, because who would fix it?"
nobody in the neighborhood fix it [for you?],nobody in the neighborhood could fix it [for you?]
"[mm-mm], see i don't have friends like that.",see i don't have friends like that.
"uh, oklahoma,","oklahoma,"
[yeah.],yes
"nah, you were big.","no, you were big."
nah you were- mm-mm.,no you were.
eh- if you just said ten and i said eight and you said younger than that.,if you just said ten and i said eight and you said younger than that.
"mm-hm. and so like, so afraid. but just"," and so like, i was so afraid. but just"
"they'd bring her things back to the classroom. that was,","they would bring her things back to the classroom. that was,"
"she'd play that beating her chest but she would also throw erasers at us, if we were misbehave.","she would play that beating her chest but she would also throw erasers at us, if we were misbehaving."
"recent like, [in the last few-] oh, [okay.]","recently, [in the last few-] oh, [okay.]"
before it went to middle sch- cause it was middle school at one [point.],before it went to middle sch- because it was middle school at one [point.]
"no, /rd-school-3/ was always elem- they done went to fifth and sixth [grade.]","no, /rd-school-3/ was always elem- they have gone to fifth and sixth [grade.]"
[before you moved over to s- mm-hm.],[before you moved over to s-.]
"so, but now it's back to like, [up to fifth, /three/-] up to fifth grade or something [like that.]","so, but now it's back to, [up to fifth, /three/-] up to fifth grade or something [like that.]"
made it new so.,made it new.
"it's so sad, all the buildings that i re- can you imagine? they've torn them down. /rd-school-3/ elementary,","it's so sad, all of the buildings that i re- can you imagine? they've torn them down. /rd-school-3/ elementary,"
"it's three miles to walk around the school, blah blah blah.","it's three miles to walk around the school, talk,talk,talk."
"mm, /rd-school-3/ junior high, i got involved in sports.","/rd-school-3/ junior high, i got involved in sports."
"but, i mean i- everyday was a great day for me at school.","but, i mean everyday was a great day for me at school."
"cursing. well actually, i wrote a girl a note cussing her out.","cursing. well actually, i wrote a girl a note cursing her out."
"and he told me that i was an ath- student athlete, blah blah blah.","and he told me that i was a student athlete, talk, talk, talk.."
and how great i was and i don't need to do this and that's why i don't curse.,and how great i was and how i don't need to do this and that's why i don't curse.
seventh gr- seventh or eighth grade.,seventh seventh or eighth grade.
cause it was /rd-school-3/ junior high school then. yeah.,because it was /rd-school-3/ junior high school then. yes.
cause she wrote me a cur- i can't even remember her name now.,because she wrote me a - i can't even remember her name now.
and he told you don't cuss cause you a sci- a [student athlete?],and he told you don't curse because you are - a [student athlete?]
"[well, you know] to that, i mean there was- back- this is not me. i'm a student athlete, blah blah blah.","[well, you know] to that, i mean there was - this is not me. i'm a student athlete, talk, talk, talk."
[thirty] years. yeah.,[thirty] years. yes.
so-so.,i was ok
mkay.,ok
"what was your favorite subject in high s- i mean, in- what was your favorite subject up to this point?","what was your favorite subject in high school- i mean, in- what was your favorite subject up to this point?"
social studies we had to do- mrs. /rd-name-1/. i had great teachers.,in social studies we had to do- mrs. /rd-name-1/. i had great teachers.
"ms.- like i said, mrs. /rd-name-1/ was social studies with all those presidents projects.","ms.- like i said, mrs. /rd-name-1/ was social studies with all of those presidents projects."
"teacher when i was in fifth grade. then became an assistant principle. i don't know if he became a principal principal, but then got into trouble. so i don't know where he is now.","teacher when i was in fifth grade. then became an assistant principle. i don't know if he became a main principal, but then got into trouble. so i don't know where he is now."
my first language arts teacher that i- r- it was the end of the school year. she started reading-,my first language arts teacher that - it was the end of the school year. she started reading-
"reading edgar allen poe to us. and i don't remember what t- uh the story was,","reading edgar allen poe to us. and i don't remember what the story was,"
moment by moment what was she gonna s- this was fourth grade.,moment by moment what was she going to say- this was fourth grade.
[what wa-],[what -]
"[i'm not] sure cause i used to- like i said, math, i loved math.","[i'm not] sure because i used to- like i said, math, i loved math."
even when they fight. i love- i wanna jump in the fight. let me get in.,even when they fight. i love- i want to jump in the fight. let me get in.
you gonna be getting in enough fights.,you're going to be getting into enough fights.
"um, so,","so,"
"the other question i wanna ask you is- okay so, now we've","the other question i want to ask you is- okay so, now we've"
[but that was coach] that was- [he was a coach he was a football] [coach i -think]. mm-hm.,[but that was coach] that was- [he was a coach he was a football] [coach i -think].
do you think that made it different. like as oppo- if he wasn't a coach that wouldn't have-,do you think that made it different. like as oppossed to- if he wasn't a coach that wouldn't have-
"it wouldn't have mattered to y- not mattered, but it wouldn't have had the same","it wouldn't have mattered to- not mattered, but it wouldn't have had the same"
"again, i mean just s- still thinking of the teachers that i've had. ms. /rd-name-3/,","again, i mean just still thinking of the teachers that i've had. ms. /rd-name-3/,"
"so called, mean or tough,","considered mean or tough,"
but i mean that- that whole moment about you're a student athlete. you're- don't cuss this girl- don't,but i mean that whole moment about you're a student athlete. you're- don't curse this girl- don't
say cuss words or whatever.,say curse words or whatever.
oh [mm-hm.],oh
"[a] after school detention. i'm not even quite sure for what, cause i was not a bad student.","[a] after school detention. i'm not even quite sure for what, because i was not a bad student."
and that's why i can't understand why i got whoopings.,and that's why i can't understand why i got spankings.
cause i was not a bad child.,because i was not a bad child.
the reason.,was the reason.
we getting into some deep seated [/??/ issues.],we are getting into some deep seated issues.
[i know] i'm thinking on this stuff right now. (laughing),[i know] i'm thinking on these things right now. (laughing)
"absolutely. our football team was great, but whether they won or l- lost,","absolutely. our football team was great, but whether they won or lost,"
cause i- i mean that was nineteen /blah blah/.,because i mean that was nineteen.
so how was [the- at the],so how was the
[right the school- the f-],[right the school- the
[yeah.],yes
[and then the f-],[and then the 
it is so odd now that i look at it thinking about the /gloop-/ groups and the clicks.,it is so odd now that i look at it thinking about the groups and the clicks.
do you know what i'm [saying.] like we were all treated the s- at least i felt that way- treated the same.,"do you know what i'm [saying.] like we were all treated the, at least i felt that way- treated the same."
/hotal-/,total
[what- mm-hm.],what?
"because we have like, the so called, honest kids.","because we have, the so called, honest kids."
but they all are not honest kid- but they are p- predominantly-,but they all are not honest kids- but they are predominantly-
and like their parents don't want them to,and their parents don't want them to
"yeah, with the other kids.","yes, with the other kids."
so isn- for a lot of people- oh it's the numbers and they get all excited.,so isn't for a lot of people- oh it's the numbers and they get excited.
"it's more than just responsibility cause i have a responsibility, /for/ that student. even though that student is thirteen, fourteen","it's more than just responsibility because i have a responsibility, /for/ that student. even though that student is thirteen, fourteen"
and i just jumped subjects. i didn't mean to do that cause we started on valdosta high [school.],and i just switched subjects. i didn't mean to do that because we started on valdosta high [school.]
"[mm], but that's- but you still talking about /rd-school-3/ high school.", but that's- but you are still talking about /rd-school-3/ high school.
"yeah, but now in a different-","yes, but now in a different-"
co- i'm saying as a- as a classroom teacher., i'm saying as a classroom teacher.
"thinking about how y- how you got into education, or how you- or even thinking about your own journey as a","thinking about how you got into education, or how you- or even thinking about your own journey as a"
don't- haven't you realized [that?],haven't you realized [that?]
[mm.] you have.,you have.
and i'm always spending my- well my- s- my free time,and i'm always spending my- wellmy free time
"you know open up the che- come on kids, what do we got- i don't know. come let's do something.","you know open up the - come on kids, what do we have- i don't know. come let's do something."
you know i'm thinking. why did i spend all my- i could be putting my [ideas] into,you know i'm thinking. why did i spend all of my- i could be putting my [ideas] into
oh i can't wait til i start making this amount of money.,oh i can't wait until i start making this amount of money.
it's n-,it's
"if the money comes, wonderful. is it- if it doesn't,","if the money comes, wonderful. if it doesn't,"
"so they gonna bully, i'll be the biggest bully, cause that's not allowed.","so they are will bully, i'll be the biggest bully, because that's not allowed."
j- raising your hand. w-,raising your hand. 
but it is. [it's very- it's very important] to me.,but it is. [it's very important] to me.
but you were- w-,but you were
"what did you just [say? you've always, always] been an educator, isn't that what you just said?","what did you just [say? you've always, been an educator, isn't that what you just said?"
"[oh lord, /i'm'a gonna die/] (whispered)","[oh lord, /i'm'a going to die/] (whispered)"
"all these wonderful educators that were in your life, when you were in the /rd-school-3/ city school system.","all of these wonderful educators that were in your life, when you were in the /rd-school-3/ city school system."
but [before i was in the-] before i was [in the school system.],but before i was [in the school system.]
[before] you were in the school system. you're mom.,[before] you were in the school system. you're a mom.
[right. but- but it was a different- it] was a different kind of way.,[right. but-it was a different- it] was a different kind of way.
"and your mom kept on pushing, pushing and calling til they had you tested","and your mom kept on pushing, pushing and calling until they had you tested"
i remember the day at s-,i remember the day at
"um, at /rd-school-4/,","at /rd-school-4/,"
"[and doesn't that] bother you? like,",[and doesn't that] bother you?
like that [still bothers me.],that [still bothers me.]
[i don't think i-] i don't have to think about it. i feel like i know why they gave me a hard time.,"i don't think , i don't have to think about it. i feel like i know why they gave me a hard time."
of what? there were like ten of us?,of what? there were about ten of us?
in my class there were two black students. i don't- i don't-,in my class there were two black students. i don't
"ms.- ms. /rd-name-2/ talk- oh, oh minnie that, huh.","ms. /rd-name-2/ talk oh minnie that,"
that was twent-,that was
because she [was a year- i had her for two years. yep.],because she [was a year- i had her for two years. yes.]
"[i know, two years cause-] yeah i know, yeah.","[i know, two years because-] yes i know, yes."
[but we also had like breakfast] and we- our class was real special.,[but we also had breakfast] and we- our class was really special.
"[oh we did. okay, so back to-] back to high school- back to high- okay.","[oh we did. okay, so back to high school- back to high- okay."
"so, it- so i was about to say, no, we were not okay cause-","so, i was about to say, no, we were not okay because-"
"and it was during that time, like","and it was during that time,"
"didn't really want- they didn't wanna coach girl- they didn't wanna coach girls basketball. it was just the principal said,","didn't really want- they didn't want to coach girl- they didn't wanna coach girls basketball. it was just the principal said,"
"cause coach /rd-name-2/, he was just like, he would sit on the bench. he wasn't tel- i don't know one play coach /rd-name-1/ has taught us yet.","because coach /rd-name-2/, he was just , he would sit on the bench. he wasn't t, i don't know one play coach /rd-name-1/ has taught us yet."
"so you're- okay, so, before we- we gonna come back to that, but before you- your- you- before your-","so you're- okay, so, before we are going to come back to that, but before you-"
"oh i was- oh great. cause it- my senior year,","oh i was- oh great. because it was my senior year,"
"twenty points right here, cause she knows i'm gonna get first place in two events.","twenty points right here, because she knows i'm going to get first place in two events."
"i don't know if it's still up [there, but it's on the board. up on the thing. mm-hm.]","i don't know if it's still up [there, but it's on the board. up on the thing."
[used to be on the back s- yeah. mm-hm.],[used to be on the back s- yes.
yeah. yes.,yes
"i'm like, i know her. (laughing)","i'm lthinking, i know her. (laughing)"
"um, so high school was pretty good.",so high school was pretty good.
problems. i mean i didn't go to anything u-,problems. i mean i didn't go to anything
"you know, i'm saying odd, like","you know, i'm saying odd,"
"no, cause i didn't- i wasn't gonna say- ask anything, or say anything about prom, prom dresses. we didn't-","no, because i didn't- i wasn't going to say- ask anything, or say anything about prom, prom dresses. we didn't-"
so why would i ask for stuff like that?,so why would i ask for things like that?
"so, no. i don't wanna go. i'm good. i'm fine.","so, no. i don't want to go. i'm good. i'm fine."
"[oh, no] it was kind of odd cause i just happened to be in a valdosta mall. i'm not even sure why i was in a mall, cause i am not a shopper.","[oh, no] it was kind of odd because i just happened to be in a valdosta mall. i'm not even sure why i was in a mall, because i am not a shopper."
"/rd-name-3/, i can't even think of her last name now. just slipped my mind, sorry.","/rd-name-3/, i can't even think of her last name now. it just slipped my mind, sorry."
"and i was like, oh hey coach. and she was like, hey /rd-name-3/, blah, blah, blah, blah. and it was just like a few minutes and she told me the lady's name.","and i was like, hey coach. and she was, hey /rd-name-3/, talk,talk, talk . and it was just a few minutes and she told me the lady's name."
"blah, blah, blah, sign here, sign there. and most people w- you have a-","talk, talk, talk, sign here, sign there. and most people you have a-"
[i-] i just signed mine on the bus. we were going to some-,i just signed mine on the bus. we were going to some-
and put it back in the- cause i didn't really think anything of it.,and put it back in the- because i didn't really think anything of it.
"your immediate family, like in your household at that time.","your immediate family, in your household at that time."
"oh, uh, yeah.",yes
"when you left elementary school to go to middle school, it's like, oh no, i wanna stay back. i don't wanna go to middle school, or junior high school.","when you left elementary school to go to middle school, it's like, no, i want to stay back. i don't want to go to middle school, or junior high school."
"and once it's time to leave junior high school and go to high school, oh no, let me stay back. i can't go to high school.","and once it's time to leave junior high school and go to high school, no, let me stay back. i can't go to high school."
hm. so glad i asked it.,so glad i asked it.
"money. cause i- and i just realized,","money. because i- and i just realized,"
"and you get a car, it's like, oh is she gonna get us a car?","and you get a car, it's like, is she going to get us a car?"
"and so i'm not very, uh,","and so i'm not very,"
and you had to do your- like your-,and you had to do your
"um, and that it's not-",and that it's not-
"and so i remember, my- my- my portfolio was themed around dr. seuss, but my teaching philosophy was about","and so i remember, my portfolio was themed around dr. seuss, but my teaching philosophy was about"
"and exposing me to like, the","and exposing me to, the"
[going to the plays.] okay /rd-name-2/ let's go to the play. [/you supposed to say/] when?,[going to the plays.] okay /rd-name-2/ let's go to the play. [/you're supposed to say/] when?
[but- but it's those moments] right? when you're teaching. [and when you're-],[but- it's those moments] right? when you're teaching. [and when you're-]
like /rd-name-3/ was like,/rd-name-3/ was like
"we went- we saw it on the big screen, no. the big- n- the big tv. [the big, big tv, right? so she didn't have] the word for movie.","we went- we saw it on the big screen, no. the big tv. [the big, big tv, right? so she didn't have] the word for movie."
"you, do. it's not simply- it's not simply, oh i'm a teacher. it's not wh- it's not simply just,","you, do. it's not simply, i'm a teacher. it's not it's not simply just,"
"[it is.] and it's not just, oh summer vacation. woo i'm off. nah, it's not like that.","[it is.] and it's not just, oh it's summer vacation. i'm off. no, it's not like that."
"cause even now you're still thinking about, well what can i do next year to make it better.","because even now you're still thinking about, well what can i do next year to make it better."
i know you are. [i know you are.] cause i know- i know-,i know you are. [i know you are.] because i know- 
"um, was it grammar [and-]",was it grammar [and-]
"and- but then i got into, oh, this is how they say it in the south. and this is how they say it in the north and the midwest and the-","and- but then i got into, this is how they say it in the south. and this is how they say it in the north and the midwest and the-"
cause language is so,because language is so
"and i wanna say that life is not just these six blocks that we live. like, you [asked me about] the neighborhood.","and i want to say that life is not just these six blocks that we live. like, you [asked me about] the neighborhood."
cause here i am.,because here i am.
"ay- you asked me about the neighbors. and i mentioned ms. sister earlier. ms. sister used to call grandmom, grandmother.","you asked me about the neighbors. and i mentioned ms. sister earlier. ms. sister used to call grandmom, grandmother."
she was butt naked.,she was completely naked.
"hopscotch and marbles and just, r- hitting a ball on top of the house, or something and she'd yell us,","hopscotch and marbles and just, hitting a ball on top of the house, or something and she'd yell at us,"
y'all hitting up my- in my garage- not garage. what is that? car- car space.,you all hitting up my- in my garage- not garage. what is that? car space.
"she didn't [have a car, who] was gonna drive there?","she didn't [have a car, who] was going to drive there?"
"but she would just yell at us, but you- she loved us- cause i'd play christian music. especially on sunday.","but she would just yell at us, but you- she loved us- because i'd play christian music. especially on sunday."
and who came? i wanna say it was /rd-name-2/. that's dot's brother.,and who came? i want to say it was /rd-name-2/. that's dot's brother.
"for a minute, but you can get all those stories from my sister.","for a minute, but you can get all of those stories from my sister."
"those were the days. yes, sheila, who was about this high, still this high, she has a three kids.","those were the days. yes, sheila, who was about this high, still this high, she has three kids."
"kids today you gotta be worried, okay that got a gun, they carrying drugs dah dah dah dah.","kids today you got to be worried, okay that got a gun, they are carrying drugs and so on."
"i don't know why i'm saying that, but i'm'a say it to you,","i don't know why i'm  saying that, but i going to say it to you,"
woo my gosh. and it was my sister.,my gosh. and it was my sister.
"that was /out/ right- right after my mom had passed and all that. and like, trying to be strong for everybody, you know, and nobody can't see me cry.","that was /out/ right after my mom had passed and all that. and like, trying to be strong for everybody, you know, and nobody can't see me cry."
"what is it, christmas? i'm'a go over do a little- i call it a run by, drive by, go see- you know how you in spirit?","what is it, christmas? i'm going over to do a little- i call it a run by, drive by, go see- you know how you in spirit?"
"so i said okay, well i'm gonna do the same thing.","so i said okay, well i'm going to do the same thing."
cause her dad told her,because her da told her
"that when i was going to school,",that's when i was going to school
it- that- she- she shouldn't tell everybody all her business. she needs to be more like me and hold it in.,it's- that she shouldn't tell everybody all of her business. she needs to be more like me and hold it in.
"uh, okay i'm talking too much. (whispered)",okay i'm talking too much. (whispered)
"uh, what's your lesson plan?",what's your lesson plan?
it was just amazing cause i've always envied her. cause she always seems to have,it was just amazing cause i've always envied her. because she always seems to have
and i- i- that's all i can- you know.,and i- ithat's all i can- you know.
yeah. so that's how i feel.,"yes, so that's how i feel."
cause i- i'm older. i'm wiser.,because i- i'm older. i'm wiser.
"uh-oh, our time is /rind-/ winding-up.","oh, our time is winding-up."
"and um,",x
/rd-name-3/ they hardly exist anymore anyway. [the one's that's living.],x
"[so you got uncle], you got",x
uh-huh.,x
your grandparents.,x
mm-hm.,x
uh-,x
cousins.,x
[cousins.],x
[a lot of my] [cousins.],x
[lots of cousins.],x
"yeah lots of cousins, [so.]","yeah, a lot of cousins, so."
[from-],x
from which side of the family /?/?,x
"my- my mother- all of princeville point blank is my mother's [side, so.]","my mother, all of princeville definitively is my mother's side of the family"
"[oh, okay.]",x
"no, my father- my mother's",x
"daddy's side, but my mother's side,",x
"her- her family is from um,",x
"baltimore, maryland so i know much about- i don't know that much [about them.]",x
[oh yeah?] yeah.,x
[nothing about them.],x
"[well just of the] people that live in [princeville],",x
[uh-huh.],x
so how many,x
family members /should we say/ you got in- in princeville?,x
too many to count? [<laugh>],x
"[i'd be counting for] [days, lord knows] i would.",x
it's a lot [of 'em.],x
[you got] a lot of 'em? [okay.],x
[it's- and] majority of 'em stay there.,x
"and um, only [probably about]",x
[/inaudible/],x
[three or four] to actually move away.,x
"but they moved to rocky mount so it's not that [far, you know.]",x
[yeah.],x
"it's not that far, but um,",x
