AAVE,SAE
"they're like yeah, lining up and- and causing ruckus in our- in our [neighborhood. please.]",they agree and are lining up and- and causing a ruckus in our- in our neighborhood. please.
"that's what it was. i even [heard this one] time i was getting my taxes done and this guy,","that is how it was. i even heard this when i was getting my taxes and this guy,"
and he was like,and he said
to come to respond before they would get out the car do anything.,to come and respond before they would get out of the car to do anything.
and how none of them ever wanted to get there. of course.,none of them ever wanted to get there. of course.
cause no cops came.,because no cops came.
o- there's no cell phones at the time.,o- there were no cell phones at the time.
[people] were out their windows,people were out of their windows
like i saw every window with a phone.,i saw every window with a phone.
those are the longest forty-five minutes i've ever seen.,those were the longest forty-five minutes i have ever seen.
y- people used to come back fucked up from cops.,y- people used to com back fucked up by cops.
this was it.,that was it.
this was us. [this was it.],that was us. that was it.
i'm down for that,i support that
chartering all the schools up,making all of the schools charters
"and i was like, you know what miss,","and i said, you know what miss,"
"i remember me telling her, like tryna hold back my tears, cause i'm very sensitive.","i remember telling her, trying to hold back my tears, because i am very sensitive."
"about- and it's always about my neighborhood. [and they] think it's about a guy, they be like","about- and it is always about my neighborhood. people think ti is about a guy, they say"
"man, we getting displaced!",we are getting displaced!
it was minority only. been there forever.,it was for minorities only. it has been there forever..
we don't know what's gonna come of that.,we do not know what is going to come of that.
i don't know what's gonna be built there.,i do not know what is going to be built there.
"one of the things is if you are under-employed, or unemployed,","one thing is if you are under-employed, or unemployed,"
"people that live in public housing. they ain't shit. even subsidies, right? you have [those] stigmatizations for that.","people that live in public houseing, they are not good. even subsidies, right? you have stigmatizations for that"
"subsidies. oh. people are lazy. they're bums. and there's violence, and there's drugs and they living off the government. they taking my tax dollars, and all of these [things.]","subsidies. oh. people are lazy. they are bums, and there is violence, drugs, and they are living off the"
"and so, here we got a federal lawyer, says, oh.","so, here we have a federal lawyer that says, oh"
and i just came out of college.,and i just got out of college.
and i got six months to find a job.,and i have six months to find a job
you sh- sounds like you sure tried [though. <laugh>],you sh- sounds like you tried.
this flyer telling people to do the community service.,this flyer is telling people to do the community service.
word. they're telling people to do this slave shit?,seriously. they are attempting to have people work with no remuneration
i brought six homegirls. my homegirls that i grew up.,i brought six close girlfriends. my close girlfriends that i grew up with.
i ain't seen them in years.,i have not seen them in years
"i just- i got, said, listen, yo. y'all heard about this community service shit?",i asked if they were aware of the community service
"[right, so,] we came in there hooded.",we came in hooded.
"and i'm like, yeah. let me sign y'all little sign in sheet. let me hear what y'all gotta say about this bullshit","and i said, yeah. let me sign your little sign in sheet. let me hear what you have to say about this bullshit."
cause it's a federal law and you can get evicted.,because it is a federal law and you can get eviced.
and here's the ways that you can do it.,and there are ways that you can do it.
it found me the work.,it found me work.
that community service requirement shit was fucked up.,the commnunity service requirement is obtrusive
and i'm like damn. i just came out of school.,i was uncomfortable because i had just completed school
to- they're like some cons- they have these conservative views. i'm like you,my brother have questionable political bearing and are conservative
you a black man. what are you fucking [f-],you are a black man. what are you fucking f-
"you know, like you gotta pull yourself [up at your boot] straps.","you know, pull yourself up by your boot straps."
you know what i'm saying?,do you understand?
"you know, and we never think about those things. like, [you know.]",right? we never thinkg about those things. understand?
"so, you gonna make- okay. if everybody's pulling they own selves up by their bootstraps, does that mean they're gonna start making their own boots?","so, you are going to make- okay. if everybody is pulling themselves up by their bootstraps, does that mean the are going to start making their own boots?"
that's what that mean? you gonna make them shine their own boots?,is that what that means? are you going to make them shine their own boots?
"you know, i don't get- you know what i'm saying. i [just]","you know, i don't get- you understand?"
[you know?,do you understand?
"and i'm seeing like, damn. i gotta do community service, and this gentrification,","and i'm seeing, damn. i have to do community service, and this gentrification,"
"i wanna be up- i- i- i wanna fight this. and then [when i found-] when goles gave me the vehicle,","i want to be up- i- - i want to fight this. and then when i found- when goles gave me the vehicle,"
"a part of the solution. not the problem, not the complainer.",a prat of the solution. not the problem or the complainer.
and i used to do things off the strength of-,and i used to do things from the the strength of-
"there was a crowd. it was all crazy in the front, and i was like, listen.","there was a crowd. it was all crazy in the front, and i said, listn."
and we don't like this shit.,we do like being placed in this situation
"and, actually, the guy's like, nah man.","and, actually the person says no"
i feel y'all. i'm from the neighborhood too. he was a guy from the neighborhood [too.],"i understand you all, i am from a similar socioeconomic background "
"or, i seen kids get strip searched in front of fucking mad people.","or, i have seen kids get strip searched in front of fucking mad people."
where cops pull down they pants.,where cops pull down their pants.
pulling they pants.,pulling down thier pants
and you got six squad cars.,and you have six squad cars.
they had their guns drawn,they had drawn their guns
[because] we was in the park playing basketball. we had beads of sweat coming down our heads.,we were in the park playing basketball. we had beads of sweat coming down our heads.
"and we was like, yo.","and we said, hey."
"now, they enforcing it. no. the parks gotta be closed.","now, they are enforcing it. no. the parks have to be closed."
"and now, i got a gun pointed at me.","and now, i have a gun ponited at me."
"so, i would ask you to like start at the beginning and tell me about kind of","so, i would like to ask you to start at the beginning and tell me about "
right there on fourteenth street.,on fourteenth street. 
"it's funny, both of my parents, um, not migrated, but yeah, kind of, from harlem.","it's ironic, both of my parents, they did not migrate, but they came from harlem. "
"they were uh, one of those uh",they  were one of those uh 
a lot of the families that were,a lot of the families were 
looking to.,wanted to. 
well- i what i understood it was that both my grandmothers were single mothers and they,"well, hopw i understood it was that both of my grandmothers were single mothers and they "
trying to,were trying to 
there was housing opportunities over here.,there were housing opportunities over here. 
and so a lot of people.,a lot of people. 
that's- i think- i can see like the history of it was like,that's- i think- i know the history of it was like
ma- like further down and spreading out [more.],further down and spreading out. 
because there was a- for housing opportunities and.,because there were housing opportunities. 
"and it's funny, then their children later on","it's ironic, then their children "
get together and have me.,get in a relationship and have me. 
that's hilarious,that's ironic. 
happenstance like lately,on happenstance and later 
"you know, years later on.","you know, years later. "
and they not together now.,and they are not together now. 
"so, what's your like ancestry? are your um, do you have like caribbean roots? or ju- african [american?]","so, what's your ancestry like? are your, um, do you have caribbean roots? or ju-african [american?]"
"[i know, i know, i know.]",[ i understand ]
"and it was really interesting because everybody was really mixed. and you know, there was like",and it was interesting because everybody was really mixed. there was like
"jamaica, then the other grandmother was from you know, atlanta, and [so everybody] had these really interesting histories, so","jamaica, then the other grandmother was from atlanta, and [so everybody] had really interesting histories. "
nope. um.,no. um. 
"to just give it back to me in my- some measly name, like oh, well you know what?","to just give it (culture) back to me in some measly name, like oh, you know what? "
"/up/ in the past, you know, we've-","in the past, you know, we've-"
"[s- it seems] like uh, not enough.",[it seems] like not enough. 
"mm. i'd rather, i'd like to call everybody brown.",mm. i'd rather call everybody brown. 
"hey man, everybody's brown. [everybody's] got some different color","hey, everybody's brown. [everybody's ] got different melanin."
i'd like that way better.,i would like that way better. 
/breries/ too [much.],/varies/ too much. 
"[so, i'm just] saying just for like",that is what i am saying 
"man,","well, "
have family down [there in the south.],i have family down there in the ssouth. 
"[do you go like, visit?]",do you go visit? 
mm-hm. [i just didn't make] the last one that we had.,mm-hm. i was not able to make it to the last reunion we had. 
"every year, we go different","every year, we travel to different "
[<laugh>] did you call? were you [like okay.<laugh>],[<laugh>] did you call? were you [like let me try this<laugh>]
i've never heard it before i [think.],i have never heard my last name before [i think].
"there's, uh, some that had two s's, it was weird. it was very crazy, but,","there's, uh, some that had two s's, which was weird. it was crazy, but, "
"it was cool. and the- it was cool to see that, and then","it was nice. and the-it was nice to see that, and then "
people was asking me what island i was- i was from.,people were asking me which island i was from 
[and i'm] like,and i think it's 
a really crazy small [island],a really small island 
"[you're like,] well, [it's an island.]","[you think,] [it's an island.]"
"it's far, and it's [crazy.]","it's far, and it's [interesting.]"
it's crazy.,it's interesting. 
cool.,nice. 
"it was four of us, and my father kind of left when i was three.","there were four of us, and my father kind of left when i was three. "
and he go ji- addicted to drugs.,and he got addicted to drugs. 
[he's] around the right time.,that's around the right time. 
"me and him, i haven't talked to him, it's funny cause i haven't talked to him for six years.","him and i have not spoken, it is ironic because i have not spokened to him for six years. "
where we're tryna,where we are trying to 
[that's cool.],[that's nice.]
"yeah, /rd-name-3/ has us in this.","yeah, /rd-name-3/ supports us in this."
uh. [wha- you-],uh. [what are you-]
we're learning how to use that though,we're learning how to use that 
[that's cool.],[that's nice.]
and there was way more negative energy used to-,and i used way more negative energy to-
[than it] was to love him.,[than to] love him. 
so. it's like a less,so. it's like less
i even feel like less energy being,i feel like less energy is being 
"you know, of me and it's- it's directly affecting me, i've ","of me and it's directly affecing me, i've "
i was like not consistent with that.,i was inconsistent with that. 
"like, i was [not consistent] with that in my life, so.",i was so inconsistent with that in my life. 
that's when i start talking with him [again.],that's when i started speaking with him [again.]
[he's still] in the neighborhood.,[he's still] in our neighborhood. 
he's still in the neighborhood to his will.,he's still in the original neighborhood intentionally. 
"and uh, it's funny because the way we found him. i found him in nineteen ninety","and uh, it's ironic because of the way we found him. i found him in nineteen ninety"
"my senior year in high school,","it's my senior year in high school, "
"and i'm worried about my cat. i got midterms and everything, and my cat is missing, and i'm going crazy.","and i'm worried about my cat. i have midterms and everything else happening, and my cat is missing, and i'm going crazy. "
"yeah, he would go out to the windows and","yes, he would go out of the windows and "
"he would do some crazy stuff, and sometimes go all throughout the building, but he would come back.","he did stuff that was out of the ordinary, and would sometimes walk throughout the building, but would return. "
"back at the door, like he always came back.","return to the door, he always came back. "
"but somebody, uh, one of the dagone maintenance men took him.","but somebody, one of the dumb maintenance men led him. "
yeah. he took him.,yeah. he led him. 
maintenance man took him and put him in the basement.,the maintenance man led him and put him in the basement.
"[they took my] cat, and put him down there for rats. [my cat.]","[they took my] cat, and put him down there to catch rats. [my cat.]"
[come on.],really? 
"when we were in the court, when i was- my sister and i were door knocking.","when we were in the court, when i was- my sister and i were knocking door to door."
[i'm like],[i thought]
[he] just answered the door?,[did he] just answer the door? 
it's like one of them houses where all the people,it's a house where all of the people 
do their drugs at and everything. [like a little] crack spot.,do their drugs. [like a] drug den. 
"[and-] but we didn't know that. anyway, we was knocking on the door.","[and-] but we didn't know that. anyway, we were knocking on the door."
we was like,"we said,"
[you were like] holy [shit. <laugh>],[you felt like] holy [shit. <laugh>]
and we just stood there still.,and we just stood there. 
"and it was like, oh, you live right across the street?","and we realized,  oh, you live right across the street?"
[oh. /rd-address-2] okay. i knew you- you- d- okay. i think /rd-name-8/ [from like- yeah.] i was like /rd-name-2/'s from /rd-address-3/. right.],[oh. /rd-address-2] okay. i knew you- you- d- okay. i think /rd-name-8/ [is from like- yeah.] i was like /rd-name-2/ is from /rd-address-3/. right.]
[it was from /rd-address-2/.],[i'm from /rd-address-2/.]
he- my father's not doing anything with himself right now.,he-my father is not currently doing anything to better himself. 
"yup, you know, i got him to help them.",i was able to convince him to help them. 
that's [cool.],that's [nice.]
"[well,] he could not volunteer. he got money. he got money to [do it. but.]",he did not volunteer. he received money. he was paid to [do it. but.]
[you know.],yes. 
"<ts> i got him involved, he got to see a little of what i do.","<ts> i got him involved, he was able to see what i do."
very cool.,very nice. 
[she's her-] close to hitting that thirty year mark point.,[she's her-] close to the thirty year mark. 
she's been helping with parents at a head start program.,she has been helping with the parents at a head start program. 
"[oh, that's cool.]","[oh, that's nice.]"
"so, she's still here and she works in the neighborhood.",she is still here and works in the neighborhood. 
"and i'm here, and i work in the [neighborhood.]",i am here and work in the neighborhood as well. 
"and i used to live with my sister, but she just moved out.","i used to live with my sister, but she moved out. "
it's probably kind of cool right?,does it feel nice? 
yeah. it's cool.,yeah. it feels nice. 
"[cause, you know.]",[because.]
"[like,] when you leave in the morning, and then you come back, and like","[like,] when you leave in the morning, and then you come back, and "
back where you left it.,where you left it. 
"now i can't blame things on my sister, [like oh.]","now i can't blame things on my sister, [for example]"
[<laugh> right. (laughing) <laugh> right.],[<laugh> exactly. (laughing) <laugh> exactly.]
[she didn't] throw out the garbage? [it's all me.],throwing out the garbage? [it's on me to do it.]
[you're like-],[you think-]
"you're like, nope.","you think, no, "
[it's all me.],[it is my responsibility.]
"i can't even like, yeah. so.",i can't blame here. 
it's putting me- [it's putting things] into perspective. like ah shit man. i gotta-,it's putting me- [it's putting things] into perspective. like shit. i have to-
"when people come over, i gotta make sure my","when people come to my apartment, i have to make sure my "
 my [stuff is] on point.,stuff is neat and tidy. 
"yeah, that's about it actually.",but that is the only issue. 
it's cool living without.,i like living without 
"i've g- i- you know, it's so funny. it's- this is a memory that's good. it's so funny that you just said this.","i've g- i- you know, it's ironic. it's- this is a memory that's good. it's ironic that you just said this."
that's good and bad in itself.,that's both good and bad. 
"when we were little, we played this game called colors.","when we were little, we played a game called colors."
kay.,okay. 
"before you left a- if we was living toge- if we was friends [and we was] growing up [together,]","before you left a- if we were living toge- if we were friends [and we were] growing up [together,]"
"before we left this house, we had to pick a color.","before we left the house, we had to pick a color."
what's your color? purple?,what color do you want? purple? 
how many crack vials we see with that color [top.],how many crack vials we would see with that color of [top]. 
"[so, we would] get ready to go to this post [office]","[so, we would] get ready to go to the post [office]"
you was letting me know every time you saw,you were letting me know every time you saw 
"and upon the end of the day,","and by the end of the day, "
we always would forget sometimes or whatever.,we would always forget sometimes. 
that's how much drugs was in this neighborhood.,that's how many drugs were in this neighborhood. 
"that was- that was a common thing in grass, so you didn't play in grass.","that was-that was common to see in grass, so you would avoid playing in grass. "
[you kept off grass],[you stayed off of the grass]
cause it's a place where dogs,because it's where dogs 
t- crapped at,pooped at 
"you had drug needles in it,","there was drug needles in it, "
[yeah. yeah. yeah. yeah.] and were there all different [colors?],[yeah. yeah. yeah. yeah.] and were there different colors? 
"so, every w- depending what color you pick, i w- my color was always purple. i gave you purple today.","so, every w-depending on what color you picked, i w-my color was purple. i gave you purple today. "
"but purple, i'd be like purple. and i'd be like, there go purp- there goes five purple!","but purple, i would say purple. and i would say, there's purp-there's five purple! "
"i used to f- i'd have like, i had like this uh","i used to f-i would have, i had a uh "
this- this science to it [like nah man. purple is] the color.,science to it [like no. purple is] the color. 
[but.] so. yeah. it was purple. and i- this was in school yards,[but.] so. yeah. it was purple. and i-this happened in school yards
"and churches. [and any type] of grass over here, there was drug needles [and] crack vials and","and churches. [and any type] of grass present, there were drug needles [and] crack vials and "
[that's the funny],[that's the irony]
"[so, we] played in parks still. we [still played] in these parks.","[so, we] played in parks still. we [stilled played] in the parks. "
"played in these parks. [so, yeah,] we still- that's what i'm saying, like","played in the parks. [so yeah,] we still-that's what i'm explaing, like "
"it was- this is a negative part of it, but","there was-this is a negative part of it, but "
"[you were like (laughing), that was a fun game]","[you laughed a lot, that was a fun game]"
[you know.],right? 
not knowing the real implications of it.,we didn't know the implications of it. 
i remember one time this boy chased us with a freaking drug needle.,i remember this boy once chased us with a freaking drug needle. 
"he picked it up and we- that was when aids was around. we was like, you didn't know about aids much, but it [was like you knew that]","he picked it up and we-that was when aids was a concerns. we didn't know much about aids, but [you knew that]"
"you associated it with drugs too and drug needles, and we was like",it was associated with drugs too and drug needles and we thought 
he's gonna give us aids! and [we used to tell everybody] he's had aids cause he picked up the drug needle!,he's going to give us aids! and [we used to tell everybody] he had aids because he picked up the drug needle! 
but there was drug needles.,but there were drug needles. 
"and, uh. the way we played, uh, we has to- we used to steal","and uh. the way we played, we had to-we used to steal "
we had to clean the gra- we had to clean the [glass off of them.],we had to clean the gra-we to clean the [glass out of the parks.]
"like, we would make like, agreements with them. like, man","we would make agreements with them. like, hey,"
please don't pee in this corner man.,please don't pee in this corner 
cause it's gonna get on the court.,because it's going to get on the court 
it's gonna get on the court man.,it's going to get on the court. 
[<laugh> just over there. just over there.],[<laugh> pee over there. pee over there.]
[and we used to beg them. yeah. just pee],[we used to beg them. just pee]
were attached to families.,had serious families. 
"but, they were like these serious public drug [users.]",they were serious public drug [users]. 
which is oddly enough.,which is odd enough. 
they still like,they still
"[they're] still there, sitting there. everything's changing around them but they're still there.","[they're] still there, hanging around there. everything is changing around them but they are still there. "
"and they call me sheryl swoops. they joke around. so, they be like","and they call me sheryl swoops. they joke around. so, they act like"
"[they're all drunk, and they're like] aye, sheryl swoops.","[they're all drunk and they say] aye, sheryl swoops. "
that- they would look at y- they were looking at me and watching me grow up and.,that-they would look at y-they were watching me and watching me grow up and 
"they still even /and/ make dumb conversation, ask me if i'm- what happened to basketball?",they still make dumb conversation and ask me if i'm-what happened to basketball? 
these are the people that- this was my neighborhood. this is where we played at,these were the people that were in my neighborhood. this is where we played 
so my mother knew that we was in the building.,so my mother knew that we were in the building. 
"um. when we was leaving the building, we had to ring the bell when we left the building, so [my mother] knew that we made it out of the building.","um. when we were leaving the building, we had to ring the bell when we left the building, so [my mother] knew we made it outside of the building. "
this is what she nee- you know.,this is what she nee-you understand. 
w- we had tight codes when,w-we had codes of conduct when 
"and i was like, but he's my family. my mother told me, you do not","and i said, he's my family. my mother told me, you do not"
"<ts> always travel in pairs. like when my sister and i, we used to always",<ts> always travel in pairs. when my sister and i used to 
"um. when we had walkmans, right, you couldn't-","um. when we had walkmans, you couldn't-"
"hold it out like now, and you had to not have it loud","hold it visibly, and you could not have it loud"
because somebody might come up and run up on you.,because somebody might come up and hurt you. 
you kept a quarter. my mother made sure we kept quarters tight on our little bras.,you kept a quarter. my mother made sure we kept quarters tight in our bras. 
there was these things that i had t- [to do.],there were things thatf i had to- [to do.]
[you sort] of knew- [you had like] a set of [rules.],[you kind] of knew- [you had] a set of [rules.]
"[rules.] yeah. when you got down the block, you- you didn't go down the whole block without looking down at least [once.]","[rules.] yeah. when you went down the city block, you-you did not go down the whole city block without look down at least [once.]"
"you know, you was taught that. you walk down the block,","you understand, you were taught that. you walk down the city block, "
"[you look,] you check yourself. check your surroundings every once in a while.","[you look,] you look around yourself. you check your surroundings once in a while. "
these the things that w-,these were the things that w-
we were just raised up with.,we were raised to do. 
there was this,there was a 
