AAVE,SAE
and where they stop on that's what they gots,and where they stop on is where they have 
"you gotta hop on one foot, and i mean hop.","you have to hop on one foot, and i mean hop "
"that mean you don't have to do nothing. you know, just jump like you jumping now.","that means you don't have to do anything. you know, just jump like how you are jumping now. "
"s mean um,",s means um 
"whatcha call that thing- you have to take your rope, and you put it on one feet, and you take that one and swing,",what do you call that thing? you have to take a rope and put it on one feet and take that one and swing 
and then they got to- then you have to turn the rope /inaudible/.,and then they have to
you have to take under large. that's when you turn back this a way.,that's when you turn back this way
"turn [that a way, and then you have to] jump [that way.]",turn that way and then you have to
"and she went down there, and she told him. he was singing rockabye baby, and he was singing all them song.",and he was singing all of those songs. 
"the monday night, tuesday night [movies.] /like if/ anything be on good.",like if anything is on that's good 
/well/ i forgot what other kind of shows i look at.,i forgot what other kinds of shows i look at
"you know anna one of the creations, so they made the creation.",you know anna is one of the creations
[the creation] living now. her name was,the creation is living now. 
the one she sposta be marrying-,the one she's supposed to be marrying 
"she like- she- she like him now, but he don't like her.",she likes him now but he does not like her
"and him, and they not gonna get married.",and they are not going to get married
"get him out of there- get him out of there. you know, he had stabbed his own self cause she didn't want him no more. she had got barn.",you know he stabbed himself because she did not want him anymore
and so they discovered him two mark holes in his neck.,and so they discoverd him with two marked holes in his neck
"now he living now,",now he's living now
"but i don't know about today cause um,",but i don't know about today because
"and she went and seen joe in his bad condition, but they didn't tell him that the uh-",and she went to see joe in his bad condition but they didnt tell him
"and put it in joe medicine. when he drink it, then he would die","when he drinks it, then he would die "
"marry him [so he asked mary-] she- maggie, he marry her.",he marrys her 
so that boy did. i don't- i ain't see it today cause i came down here.,i did not see it today because i came down here 
nothing really interesting on?,nothing really interesting is on?
[i ain't really-],i have not really
"mm-mm. i mostly stay on with my /friday/. no, i ain't [hardly look at that.]",no i have not hardly looked at that
i don't hardly go there.,i hardly go there. 
cause my money get scarce.,because my money gets scarce
he do anything,he does anything
his wife was grey and white. she was a real skinny. she had some kittens.,she was really skinny
i don't know what she did with 'em.,i don't know what she did with them. 
"ran away somewhere, and they were by theyself.",ran away somewhere and they were by themselves
and i ain't gonna have a big dog.,and i am not going to have a big dog. 
she know greek language like that.,she knows greek language like that. 
none of 'em.,none of them. 
you don't like any of 'em at all?,you don't like any of them at all?
and he don't know how to write.,and he does not kow how to write 
he don't know how to /spelled/.,he does not know how to spell
"she gonna take me and uh, two other girls over my- over her house tomorrow.","she's going to take me and uh, two other girls over to her house tomorrow"
[we gonna have] another party over her house.,we're going to have another party over at her house 
she help me with my work.,she helps me with my work
"she took me over her house, and we had dinner.",she took me oer to her place and we had dinner
she live across the street from /rd-name-2/.,she lives across the street from
"you see, he- when you come there, on the first day of september, we start back to school, s- you go every","you see, he- when you go over there, on the first day of september, we start back to school "
"he said, it's my teacher. i said, you ain't getting her.",he said it's my teacher and i said you are not getting her
reach for the hair. reach for anything. i don't know. as long as i get 'em scratched.,"reach for the hair, reach for anything. i don't know. as long as i get them scratched "
"/when it's/ my sister wear something of mine,",when my sister wears something of mine
"when i get mad, i get starting to cry, and that's what makes me mad.","when i get mad, i start to cry and that's what makes me mad"
"then somebody do something,",then somebody does something. 
i tell 'em to,i tell them to
"she'll take the ball and run with the ball. i said, throw me the ball, and she still be running. that made me mad.",she'll take the ball and run with the ball. i said throw me the ball and she'll still be running. that made me mas. 
she don't let you get out and put,she does not let you get and put
trash in the trash can. that make me mad right there.,trash in the trash can. that makes me mad right there
we had a accident outside our school.,we had an accient outside our school. 
"he- he live where miss /rd-name-2/ live, in that apartment /eleven eleven/, across the street from us.",he- he lives where miss/rd-name-2 lives in that apartment across the street from us
they call him- they send him a letter,they call him- they sent him a letter 
and told him that they be writing back to him.,and told him that they write back to him
all us started crying.,all of us started crying 
"/mother sent/ away. he had about eight or nine cakes, and they all different kind.",mother sent away. he had about eight or nine cakes and they are all different 
piece of one. and we coulda got all eight- we coulda got,piece of one. an dwe could have got all eight. we could havve got 
"pieces of all eight of 'em, but i didn't want all eight of 'em [cause-]","pieces of all eight of them, but i didn't want them because "
"no, she don't holler at me cause i holler at her back.","no, she did not holler at me because i holler at her back "
she don't holler at [me.],she does not holler at me
cause i holler at her back.,because i holler at her back 
cause,because i holler at her back 
cause i done holler at her [back.],because i have hollered at her back. 
"she don't mess with me. she tell me to sit down, and i sit down.",she does not mess with me. she tells me to sit down and i sit down 
"she going all the way- i don't care how try- how hard you try you do, she gonna always tell you something wrong with it.",she's going all the way- i don't care how hard you try she's always going to tell you something you did wrong with it
"and you make some letters, she gonna always tell you, you try to do it your best, she gonna always tell you something wrong now. that's the best you can do, and she gonna tell you that's wrong.","and you make some letters, she's going to tell you to try and do your best , she's always going to tell you something is wrong now, that's the best you can do and she's going to tell you something is wrong "
i wasn't gonna do it over.,i was going to do it over 
so what she do- goes and do is go tell mister /rd-name-1/.,so what she does is go and tell miss
he [the principal?],he's the principal?
"i don't like him neither, cause he mean.",i don't like him too because he's mean
"but he scared though. like you say- or you go and get your mother or father,",but he's scared though 
"when you finish this work, she gonna give you a lot a more. she don't want you j- stop getting busy now.","when you finish this work, she's going to give you a lot more . she does not want you to stop being busy now"
you done did all the work like you said. i did this. i did this. she won't let you read your library books or nothing. ,you did all the work like you said. i did this. i did this. she won't let you read your library books or anything. 
she tell you to keep on on something else.,she tells you to keep on on something else. 
"and then you finished all your work now, and she gonna tell you to keep on with something else.",and then you finish all your work now and she's going to tell you to keep doing something else
all them children get so mad at her. all except the chinese. /i don't see how they can/ stand her. they love to do some work.,all those children get so mad at her. all except the chinese. i don't see how they can stand her. they love to do some work. 
[i just- i] just can't stand him. he wanna do every- work every second.,i just can't stand him. he wants to do work every second 
"she wants to do something, too, so she keep on doing it.","she wants to do something too, she she keeps on doing it "
he jone on you.,he jones on you. 
and i fed you a hamburger. like that. he- he jone on you like that.,and i fed you a hamburger. like that. he-jones on you like that
"[he say], you bring back a dirty piece of paper, i'm'a jone on you.","he said, you bring back a dirty piece of paper, i'm going to jone you "
[he] jone on you. he make you embarrassed in front of all [/these people/.],he jones on youl he makes you embarrassed in front of all these people
some man teachers.,some men teachers 
that's cause he joned on you. <laugh>,that''s because he joned on you 
"let you do something all the- our teacher we got now, she won't even let us play a game.","let's you do something all the- our teachers we have now, she won't let us play games"
we sposta go in-,we're supposed to go in-
"sposta go out ten minutes til eleven, come back [five] after eleven. now she wait til","supposed to go out ten minutes until eleven, come back five after eleven. now she waits until"
"eleven o'clock, and then take us out. and we only have but",eleven o'clock and then takes us out. and we only have but  
[all the patrols.] all the [patrol that wanna be chose] be in a room. we have meeting.,all the patrols. all the patrol that wants to be chosen is in the room. we have a meeting 
"they write a- she give us a piece of paper, and you write down the name.",they write a- she gives us a piece of paper and you write down the name
"cause you really wanted to be a lieutenant, huh?","because you really wanted to be lieutenant, huh?"
long- just as long i wasn't the lowest thing there is. she the lowest thing that is.,long- just as long as i wasn't the lowest thing there is. she's the lowest thing that is
but the captain tell me what to do. i can't tell him- but i can tell everybody else,but the captain tells me what to do. i can't tell him- but i can tel everybody else
all of 'em except him.,all of them except him. 
"so in another words, you have sargeants,","so in other words, you have sargeants"
be the group that you wanna be with?,be the group that you want to be with?
they don't wanna fight.,they don't want to fight 
they don't wanna,they don't want to fight 
they don't say nasty word like that.,they don't say nasty words like that. 
"i mean, you know, like somebody pick on you. you hit 'em back, but you know, they don't wanna fight everybody they see.","i mean, you know, like somebody picks on you. you hit them back, but you know they don't want to fight everybody they sees"
i don't like the people that talk about people.,i don't like people that talk about people. 
do y'all get along?,do you al get along?
"tell to do, they do it. when somebody else tell them, they don't do it.","tell to do, they do it. when somebody else tells them, they don't do it"
now or where you [gonna go]?,now or where youre going to go 
"[no, i be-] i like- no, i let them","no, i am like- no i let them"
play what they wanna play. you know i play with them.,play what they want to play. you know play with them. 
i can beat all of 'em.,i can beat all of them
you can beat 'em all up. have you ever fought them all?,you can beat them all up. have you ever fought them all?
"cause, they wanna fight me, i wanna fight them.","because, they want to fight me, i want to fight them. "
"i, just like i said, i don't like people talking about people. i don't like them kind of people.","i, just like i said, i don't like people talking about people. i don't like those kinds of people. "
and on to high school. what do you wanna do when you finish?,and on to high school. what do you want to do when you finish?
i wanna be a teacher.,i want to be a teacher
does it- do you think it's gonna take,does it- do you think it's going to take
i don't wanna go.,i don't want to
cause they do too much work. /ooh/.,because they do too much work
/cause/ i think they'll be one the best years of your life.,because i think they'' be one of the best years of your life 
"had such bad times with teachers. um, what kind of teacher are you gonna be?","had such bad times with teachers. um, what kind of teacher are you going to be?"
[teacher.] i don't- i don't wanna holler.,i don't. i don't want to holler
i be over with my friends.,i am over at my friends
[sometime] they- he ride us out in maryland.,sometimes they- he rides us out to maryland
oh dang.,i apologize.
it's still cool too.,it's okay.
"met you at a low point, man. i had lost my job",i met you at a low point. i had lost my job
"pretty- nah, actually i was working at /rd-work-3/ getting eight dollars an hour.","no, actually i was working at /rd-work-3/ earning eight dollars an hour."
"[and-] and, you know what i'm saying, i was on the food stamps.","and- and, you understand, i was on food stamps."
"[i'm-] i'm tryna, you know, figure things out, like what's going on.",i am- i am trying to figure things out and what is going on.
"you know, they","understand, they"
got that snap works two point o.,have snap works two point o.
"tryna find a job,","trying to find a job,"
"you know, get better pay, all that good stuff.","understand, get better pay, and other things."
"but then hear this nigga /rd-name-1/,",but i heard this nigga /rd-name-1/
"talking about some business shit. and i was like,","discussing business shit. and i said,"
hold up now.,hang on.
he talking production.,he is talking about production.
he talking about some shit,he is talk about shit.
"i can instantly benefit off of. so i'm like, okay, let me see what this man talking about.","i can benefit from instantly. i said, okay, let me see what this man is talking about."
"yeah i got a record c- a record label, this that /??/. old big shot sounding ass nigga, you know, you know, little flex.","i got a record c- a record label. i'm a big shot, understand, i'm proud of myself."
little sauce and juice on it.,it's exciting.
"i was like, alright, bruh. let me- let me- w- let me holler at you real quick, you know what i'm saying.","i said, alright. let me- let me- w- let me talk to you about it, understand."
said something to me cause i was a- i was always looking for somebody who-,said something to me because i was a- i was always looking for somebody who-
like my manager,my manager
but not too old to where he in a whole nother generation.,but not too old where he is in another generation.
"you know what i'm saying, like,","understand, like,"
"you right there,","you are right there,"
you know what i'm saying. you ain't even cocky at all.,you understand. you are not even arrogant at all.
"like people wouldn't know,","people would not know,"
"you know what i'm saying, til they start talking to you.","understand, until they start talking with you."
we hear o- everybody on the- on the radio talking about some i did it on my own i did it my own. self made.,we hear o- everybody on the- on the radio talking about how i did it on my own. i'm self made.
"you know, all this and that.","you know, all of that."
but they really got a whole team behind them.,but they have a whole team behind them.
"<laugh> [yeah], i got plenty more.","yeah, i have plenty more."
legit living in atlanta,legitimately living in atlanta
"uh, what was- this was like twenty fifteen.","uh, what was- this was twenty fifteen."
right around november,around november
"and, uh, you know, it was just like","and, uh, understand, it was"
"you know, everybody is kind of in this closed box. i- [it's no-]","understand, everybody is in a closed box. i- it's no-"
[rockdale's] in georgia. [it's pretty much],rockdale is in georgia. it is
"at the end of the east side, like, you know what i'm saying. it's like the literally, like,","at the end of the east side, understand. it is the,"
"i've been in rockdale since i was in the fifth grade, man. [it was-]",i've lived in rockdale since the fifth grade. it was-
where i'm hailing from right now.,where i am living now.
[so] where did you came from before that?,so where did you come from before that?
you know what i'm saying.,understand.
"you know, my family- i got strong ties in milwaukee.","understand, my family- i have strong ties in milwaukee."
"that's- you know, that's my- my pop's side of the family,","that is- understand, that is my- my pop's side of the family."
"you know, get to know.","understand, know."
"grandfather, that's what even brought me to this place right now,","grandfather, that is what brought me to this place right now,"
"[that's real.] that's real. i will definitely wanna,","that is genuine. that is genuine. i will definitely want to,"
"you know, touch more on","understand, touch more on"
"you know, some- certain things my parents done, you know, right or wrong,","understand, some- certain things my parents did, understand, right or wrong,"
of where i'm at with my family.,of where i am with my family.
"throughout my life, they've definitely checked in, have definitely helped me","throughout my life, they have definitely checked in on me, have definitely helped me"
"so it's just like, as the- as-","so it is, as the- as-"
"we solid,","we are solid,"
they're there for the important things for sure.,they are surely there for the important things.
i'm actually the oldest,i am actually the oldest
"and it's just like, <laugh> i'm the oldest, but","and, i'm the oldest, but"
i grew up like,i grew up
you that much older?,are you that much older?
"not that i'm that much older, like","nto that i am older,"
it's just- we're just all far apart.,we are just far apart.
"you know, my mom o- had- only had two kids. my da- my dad had other,","my mom o- had- only had two kids. my da- my dad had others,"
at the crib by myself.,at home by myself.
"so it was just like, you know, i had other siblings, but i didn't have","i had other siblings, but i did not have"
"the time to ha- have 'em all under my wing, and","the time to ha- have them all under my wing, and"
me be able to touch them all how i want to,be able to touch them all how i wanted to
"which i really wish, but, you know, that- that's not,","which i wished, but, understand, that- that is not,"
"nah, definitely,","no, definitely,"
"i guess we could start with, um,","we could start with, um,"
maybe like,maybe
"tough cause i was a weirdo, man.",tough because i was a weirdo.
[it's way] cooler to be a weirdo now. not so much back then though,"it is better to be a weirdo now. no back then, though"
"[nah, not-] not- not- not at all back [then.]","no, not back then."
[like i was] suffering back then.,it was tough back then.
"my shit was so dry, bruh.",my life was tough.
"they say the meek shall inherit the earth, so you just never [peaked yet, man.]","they say the meek shall inherit the earth, so you never peaked yet."
[and i- i'm a late] bloomer.,i was a late bloomer.
"you a late [bloomer. i am too, man.]",you are a late bloomer. i am too.
"[i'm a late bloomer. it] is what it is, [you know] what [i'm saying.]","i am a late bloomer. it is what it is, undertsand."
that was my biggest background was poetry,my biggest background was poetry
"[you know] what i'm saying, she the one taught me that shit.","understand, she was the one that taught me things."
"you know, she encouraged me to keep going,","understand, she encouraged me to keep going,"
"and from there, i was like, okay.","and from there, i said, okay."
"you know, it was just like-","undertsand, i said-"
"you know, it was six grade, like i said, i'm- being the only child,","unerstand, it was sixth grade, like i said, i am- tas he only child,"
"yeah like, so it was just like, we all lived in that house, but","so, we all lived in that house, but"
it's like we didn't really actually communicate with each other.,we did not communicate with each other.
the only thing that provided me some type of hope towards,the only thing that provided me with hope towards
"a better future and this that and the other which is,","a better future which is,"
"you know, crazy cause i still don't-","understand, crazy because i still do not"
i don't fuck with school.,i do not do school
you really [enjoyed] going to school like that [though.],you really enjoyed going to school though.
you see what i'm saying.,you understand.
"like i said, poetry like came along and,","poetry came along and,"
"you know, once i found out how to start writing, bruh, like","understand, once i learned how to start writing,"
"[when were y- when] were you- when were you poetry guy, like when were you the best at the [poetry?]","when were y- when were you- when were you poetry guy, when were you the best at poetry?"
poets aren't like artists like rappers.,poets are not artists like rappers.
"[i write] poetry, you know what i'm saying, and be spitting poetry bars.","i write poetry, understand, and speak poetry verses."
"[like motherfuckers] write that shit in they class,","like motherfuckers write that in their class,"
"it's like, in the back.",it is in the back.
"[on some cool] shit, you know what i'm saying. [like]","on cool things, undertsand."
"at that time, like ninth grade- like ninth grade's when i started","at that time, ninth grade- ninth grade is when i started"
"that's like evidence you was doing it before it was trendy,",that is evidence you were doing it before it was trendy.
"before it was cool [and shit like] that. nah, [definitely.]","before it was cool. yes, definitely."
those people i think are the rawest. i'm-,i think those people are the most genuine.
i was definitely doing this beat shit before there was youtube,i was doing this beat before youtube
"it came natural, you know what i'm saying, like this-","it came natura, understand, like this-"
"like it was a gift that was already given to me, and",it was a gift that was given to me
"um, they was born in saint vincent.","um, they were born in sain vincent"
[mm-hm.],yes
"[somebody] gonna wanna me different. oh, i'm'a wear black because just because.","somebody that wants to be different, oh, i'm going to wear black because, just because."
mm-hm.,yes
mm-hm.,yes
mm-hm.,yes
you got a particular crew you hang with now?,do you have a particular crew you hang with now?
"and i can sing a little bit, but i'm shy. so i won't do no singing in this studio. [<laugh>]","and i can sing a little big, but i'm shy. so i won't do any singing in the studio."
e- equal up with some [science.],equals up with science
your crib from the school?,your house from the school?
"they would never do nothing, so.","they would never do anything, so"
you had them hands.,you had those hands
"was there any type of games for fun, that y'all would play?","were there any type of games for fun, that you all would play?"
"different attitudes. cause you know, a lot of people come in here, they got attitudes about they lotto,","different attitues. because you know, a lot of people come in here, they have attitudes about their lotto."
kay.,okay
"nah, definitely definitely.","no, definitely definitely"
yeah.,yes
"what, um- are you the youngest? the oldest? are y'all [close /??/?]","what, um - are you the youngest? the oldest? are you all close?"
you was treated differently because you was the youngest? or what not?,you were treated differently because you were the youngest? or what not?
[mm-hm.],yes
mm-hm.,yes
"i mean i talk to them every now and again, but i don't see 'em.","i mean i talk to them every now and again, but i don't see them."
mm-hm.,yes
"that you didn't see for a while come around. and it would just be like- you know, old times. it would be fun.","that you didn't see for a while would come around. and it would just be like - you know, old times. it would be fun. "
[mm-hm.],yes
it's called mass. it's like when you get like your costume and you dress up. and you in a parade.,it's called mass. it's like when you get like your costume and you dress up. and you're in a parade.
[mm-hm.],yes
mm-hm.,yes
[mm-hm.],yes
"for a mid line, three. back line,","for mid line, three hundred. back line,"
the least is like two fifty.,the least is like two hundren and fifty dollars.
[mm-hm.],yes
"so, mm-hm.","so, yes"
mm-hm.,yes
[mm-hm.],yes
"mm-hm, [that what they do.]","yes, that's what they do."
"so it be easy for you to maneuver in it, but if you're playing like a regular you know like, regular costume,","so it would be easy for you to maneuver in it, but if you're playing like a regular you know like, regular costume,"
but you're not gonna notice what he has on because it's only,but you're not going to notice what he has on because it's only
mm-hm.,yes
"okay, okay. nah, i definitely, definitely dig that.","okay, okay. no i definitely understand that."
"just randomly, what's your thoughts um,","just randomly, what are your thoughts um,"
"got chicks in some type of dungeon situation and i'm not sure how true that is, but","got women in some type of dungeon situation and i'm not sure how true that is, but"
