AAVE,SAE
"if you sit here and cry about it, you're gonna stay in eleventh grade.","if you sit here and cry about it, you're going to stay in eleventh grade."
"and like, i don't wanna stay in eleventh grade.","and like, i don't want to stay in eleventh grade."
"or i don't wanna have to redo any of this over. so like,","or i don't want to have to redo any of this over. so like,"
"and then, um,",and then
"and at the end, you'll have- um,","and at the end, you'll have-"
you'll have like a final meeting. so basically you would have to get,you'll have a final meeting. so basically you would have to get
"before i got to my senior year, i sat on probably like five different senior committees, really, so you kno- understand and know what it looks like and how the process goes.","before i got to my senior year, i sat on probably five different senior committees, really, so you kno- understand and know what it looks like and how the process goes."
"um, my senior project was capoeira.",my senior project was capoeira.
"which, uh, that year i ended up quitting football because","which, that year i ended up quitting football because"
"i gotta go to school tomorrow. and then, m- also senior year i had a job. and i'm just like,","i have to go to school tomorrow. and then, m- also senior year i had a job. and i'm just like,"
but luckily like senior year i didn't really have much classes,but luckily senior year i didn't really have many classes
"because i had- um,",because i had
getting whatever i needed out the way,getting whatever i needed out of the way
"okay i got all this free time, or","okay i have all of this free time, or"
i'm'a just slack a little bit.,i'm going to just slack a little bit.
"no, i gotta hold myself accountable, i still got this.","no, i have to hold myself accountable, i still got this."
"and really the real world, cause when i went into college i was going to school, but i was also","and really the real world, because when i went into college i was going to school, but i was also"
"i gotta go home and have my mom wash my clothes because i don't know how. and i'm like,","i have to go home and have my mom wash my clothes because i don't know how. and i'm like,"
"or, oh, i gotta go and ask so-and-so for money because- i'm like,","or, oh, i have to go and ask so-and-so for money because- i'm like,"
"main thing is like, okay (whispered),","the main thing is like, okay (whispered),"
we got diversity,we have diversity
cause i'm like in this class with,because i'm like in the class with
"so we're reading all these like scholarly articles on these different alternative literacies, and","so we're reading all of these scholarly articles on these different alternative literacies, and"
"cause she like, dove into it. she was actually going for her",because she dove into it. she was actually going for her
"she's like, yeah this is-","she's like, yes this is-"
"so, um,",so
yeah it was-,yes it was
"[but again], um,",but again
"like by the time like eleventh grade, i'm like oh, um, i want a class about so and so and so and so. they're like,","like by the time eleventh grade, i'm like  oh, i want a class about so and so and so and so. they're like,"
"create it. i'm like,","create it, i'm like"
"you're gonna be my advisor? yeah i'll be your advisor. okay, so i-","you're going to be my advisor? yes i'll be your advisor. okay, so i-"
"doing the work and basically making my own like, assignments and curriculum. like, do you think this is enough? i remember i had- i had one, um,","doing the work and basically making my own, assignments and curriculum. like, do you think this is enough? i remember i had- i had one,"
really? you sure?,really? are you sure?
"i- i- just- i feel like it's not enough. she's like no no no,","i- just- i feel like it's not enough. she's like no no no,"
it was- it was nice. it was dope.,it was- it was nice. it was awesome.
"i got to- i got to learn, again, a lot about myself and a lot-","i have to- i have to learn, again, a lot about myself and a lot-"
"um, i'm a very introverted type of person.",i'm a very introverted type of person.
up until,until
"i saw the world around me, but it was just like, i don't wanna participate in that. so i'm'a just stay in my bubble.","i saw the world around me, but it was just like, i don't want to participate in that. so i'm going to just stay in my bubble."
i gotta start doing something about this.,i have to start doing something about this.
"and, um,",and
"um, with,",with
so like people are coming out of class and everybody's just like crowding around. and they're like-,so people are coming out of class and everybody's just like crowding around. and they're like-
"luckily i had my advisor, like right there with me.","luckily i had my advisor, right there with me."
"she's like, no,","she's says, no,"
"stop, you gotta wait until after he's done. (laughing)","stop, you have to wait until after he's done. (laughing)"
"nobody here when i started. like, (laughing)","nobody was here when i started. like, (laughing)"
"so, um, i ended up","so, i ended up"
[/yeah./],yes
it was three other students.,there were three other students
"they kind of pretty much got pushed to the side. cause we were just sitting here and then we're like, /??/ i-","they kind of pretty much got pushed to the side. because we were just sitting here and then we're like, /??/ i-"
"i got all these theories. i'm like,","i have all of these theories. i'm like,"
"in, um-",in
"i use like, again, like my environment i was like, um, so if we're talking about like alternative literacies like,","i use like, again, like my environment i was like, so if we're talking about like alternative literacies like,"
"be honest with you man, from the hood. so,","be honest with your man, from the neighborhood. so,"
"i'm like, you take a drug dealer,","i'm like, for example a drug dealer,"
"but yeah, it was just like weird. it's like,","but yes, it was just like weird. it's like,"
this big wig come to town and you want me to talk to him?,this important guy comes to town and you want me to talk to him?
"yeah, the spring semester of my senior year,","yes, the spring semester of my senior year,"
"yeah,",yes
there is no more classes i can take.,there are no more classes i can take.
"i don't know if i'm a failure, i just don't w- wanna spend that like-","i don't know if i'm a failure, i just don't w- want to spend that like-"
"okay- nah, no you need to- you need to take some time, figure out what exactly you want to do in life.","okay- , no you need to- you need to take some time, figure out what exactly you want to do in life."
my community. i wanna help,my community. i want to help
"and, um,",and
"me and her was having a meeting, she just called me up one day. she's like, come over, let's have a meeting. i'm like, alright.","me and her were having a meeting, she just called me up one day. she's like, come over, let's have a meeting. i'm like, alright."
"it's slightly less extensive than the peace corps. cause i found out the peace corps, you gotta do like video interviews and skype and [all that.] but, um,","it's slightly less extensive than the peace corps. because i found out the peace corps, you have to do video interviews and skype and [all that.] but,"
"and then, um, i did some upward bound at mcc and then i hosted something at","and then, i did some upward bound at mcc and then i hosted something at"
"monroe. and i'm just like going to all these different places cause i'm like,","monroe. and i'm just like going to all these different places because i'm like,"
i wanna go,i want to go
"everywhere. i wanna offer my service everywhere touch- excuse me, touch as many people as possible.","everywhere. i want to offer my services everywhere touch- excuse me, touch as many people as possible."
"and, um,",and
yeah.,yes
"but, uh,",but
"yeah. i'm like it- it- it was- it was nice,","yes, i'm like it was it was nice"
"um, as in /rd-work-4/ is like,","as in /rd-work-4/ is like,"
something coulda happened.,something could have happened.
"um, at /rd-school-2/ i'm allowed to- i have that connection with the home, the school, the student, the parent and it's like that full circle.","at /rd-school-2/ i'm allowed to- i have that connection with the home, the school, the student, the parent and it's like that full circle."
and then with it being a all male school and,and then with it being an all male school and
"i'm like, yo look,","i'm like, hey look,"
"<ts> yeah it's [like],","<ts> yes it's [like],"
job-ish,job
"okay, great. [so, i have] a- like","okay, great. [so, i have] a"
"a couple more questions. [um,]",a couple more questions. 
"that are more so geared toward, like,","that are more so geared toward, "
"what you wanna see improved,","what you want to see improved,"
"i remember like all the festivals, all- all of that stuff.","i remember all the festivals, all- of that stuff."
stuff started shutting down.,stuff started closing.
"uh, uh, a constant thing, but i do remember like being around like eleven and start,","a constant thing, but i do remember like being around like eleven and started,"
shutting down.,closing
"being like fourteen, fifteen and all of a sudden they're like-","being like fourteen, fifteen and suddenly they're like-"
"it felt like it was a war on the youth. like,","it felt like there was a war on the youth. like,"
"now you got a curfew. i'm,","now you have a curfew. i'm like,"
"that was a phase where i was like, no, i don't wanna be here. i gotta get out. i wanna get out. i wanna move. like,","that was a phase where i was like, no, i don't want to be here. i have to get out. i want to get out. i want to move. "
"get rochester, rochester don't got nothing for me.","get rochester, rochester doesn't have anything for me."
seventeen-ish,about seventeen
cause also with,because also with
"like, the war on like",the war on
"and then, um,",and then
"um, but then i had the opportunity to join, um, it was like a downtown like initiative","but then i had the opportunity to join, it was like a downtown like initiative"
"where a lot of different like business owners downtown are like, okay, we're gonna try and like,","where a lot of different like business owners downtown are like, okay, we're going to try and like,"
get something for the youth to do. we're gonna try and,get something for the youth to do. we're going to try and
"and, um, together we brainstormed, and opened,","and,  together we brainstormed, and opened,"
"uh, what was called the /rd-work-2/.",what was called the /rd-work-2/.
"any kids that's outside and that don't got nothing to do, or","any kids that' are outside and that don't have anything to do, or"
"and, um,",and
"are doing a lot of different stuff in the community, i'd be like, oh yeah i know so and so from the /rd-work-2/. and i know that person from the /rd-work-2/, like,","are doing a lot of different things in the community, i'm  like, oh yes i know this person and that person from the /rd-work-2/. and i know that person from the /rd-work-2/, like,"
let's try and bring the /rd-work-2/ back.,let's try to bring the /rd-work-2/ back.
"it was like okay, so you got this program,","it was like okay, so you have this program,"
when you hold monthly shows and you got these kids coming up and performing on stage. and you got,when you hold monthly shows and you have these kids coming up and performing on stage. and you got
"the arts in rochester are always been a thing,","the arts in rochester have always been a thing,"
"a lot of people were doing it, there was like a gap.","a lot of people were doing it, there was somewhat of a gap."
"so like, i mean, i'm-","so, i mean"
nobody was doing nothing with that. and then you have,nobody was doing anything with that. and then you have
"so, um,",so
"you go to a open mic,","you go to an open mic,"
"around that time is where i started like, really being like, yo rochester","around that time is where i started, really being like, hey rochester"
is really dope. it's just- it's a diamond in the rough. like we have,is really awesome. it's just- it's a diamond in the rough. like we have
"the reason why it was hard to harness, is because a lot of people had the crab in the bucket mentality. yo,","the reason it was hard to harness, was because a lot of people had the crab in the bucket mentality. hey,"
i wanna be the one to make it out.,i want to be the one to make it out.
i don't wanna help you make it out.,i don't want to help you make it out.
"i don't want to tell you that you good, or that you dope or","i don't want to tell you that you're good, or that you're awesome or"
then that mean less opportunities for me.,then that means less opportunities for me.
yeah. now it's ye- it's-,yes. now it's ye- it's-
"it is what it is [right now.] um,",it is what it is [right now.] 
"monday nights, they got a open mic over here at clarissa's. uh, tuesday nights they got a open mic out in","monday nights, they have an open mic over here at clarissa's. tuesday nights they have an open mic out in"
"uh, wednesday nights, they got a open mic,","wednesday nights, they have an open mic,"
"um, i think somewhere out in like, east rochester. thursday nights they got a open mic","i think somewhere out in like, east rochester. thursday nights they have an open mic"
"and literally people get on stage and just like, freestyle live collab. so you'll have a person spitting, you'll have a person playing. /and you-/","and literally people get on stage and just freestyle live collab. so you'll have a person spitting, you'll have a person playing. /and you-/"
"like, a-",a
"but i wanna have one dedicated just for,","but i want to have one dedicated just for,"
"they got all these people headlining,","they have all of these people headlining,"
"you know, they famous so yeah. you know they got talent, but like, realistically","you know, they're famous so yes. you know they have talent, but, realistically"
"i know people that's better than 'em that lives right here, like.","i know people that are better than them that live right here, like."
[every] time [yeah.],"everytime, yes"
"[and] then you got- you got danielle ponder, you got, um, jimmie highsmith. you got","[and] then you have- you have danielle ponder, you have jimmie highsmith. you have"
"name me five people that's better than 'em, [like.] (laughing)","name five people for me that's better than them, [like.] (laughing)"
"and it's like i wanna- i wanna do something that really like,","and it's like i want to- i want to do something that really,"
"um, i don't really know how to do it.",i don't really know how to do it.
[yeah.],yes
[i have-] i have- i have a love hate relationship in what i wanna do with life.,[i have-] i have- i have a love hate relationship in what i want to do with life.
"i wanna go move to atlanta, and i'm going to go to atlanta, and i'm gonna make it.","i want to go move to atlanta, and i'm going to go to atlanta, and i'm going to make it."
"and, um,",and
"frequent rochester, cause home- like,","frequent rochester, because home- like,"
"i guess the real reason why i really wanna just travel is to like,","i guess the real reason why i really want to just travel is to,"
[yeah.],yes
[how] do you feel like we're different from like,[how] do you feel we're different from
"like you can hear somebody from the city and be like, okay yeah, they're from the city.","like you can hear somebody from the city and be like, okay yes, they're from the city."
where they from?,where are they from?
"okay, yeah [so]","okay, yes"
"this is new for me. this whole like, rochesterian accent thing.","this is new for me. this whole, rochesterian accent thing."
yeah.,yes
"but i guess like, the rochester accent is like,","but i guess, the rochester accent is,"
"/cause i/ get people that, um,","because i/ get people that, "
"come from- from like out of town, they'll be like, yo what's up with the accent? i'm like,","come from- from out of town, they're like, hey what's up with the accent? i'm like,"
"you hear- you can hear- in new york city you can hear a bronx accent be like, okay.","you hear- you can hear- in new york city you can hear a bronx accent are like, okay."
"you hear a brooklyn accent be like,","you hear a brooklyn accent and are like,"
"be speaking english, or they're not from","is speaking english, or they're not from"
"cause, i mean we have,","because, i mean we have,"
"[yeah],",yes
"uh, [a very] diverse culture. so like,","[a very] diverse culture. so like,"
this right here is a rochester accent and i can hear it and be like-,this right here is a rochester accent and i can hear it and am like-
"cause i be like, do i have a rochester accent? and they're like,","because i'm like, do i have a rochester accent? and they're like,"
"nah nah, i'm like, well, i've been here my whole life, so it-","no, no i'm like, well, i've been here my whole life, so it-"
yeah.,yes
"i'm glad you brought that up. i was just gonna ask you like, what are the stereotypes about sort of this place,","i'm glad you brought that up. i was just going to ask you, what are the stereotypes about sort of this place,"
"uh, is basically-",is basically
basically a smaller chiraq.,basically a smaller chicago.
"there's been times where,","there have been times where,"
man done got popped literally by,a man has gotten shot literally by
gonna definitely prove you wrong. so if that means,going to definitely prove you wrong. so if that means
that's what i'm gonna do.,that's what i'm going to do.
times be getting hard.,times get hard.
"it be like yo, alright,","it's like hey, alright,"
i need to call up my boy right now and say,i need to call my close friend right now and say
why? cause you feed into statistic that's what they expect of you.,why? because you feed into statistic that's what they expect of you.
that's what they waiting for you to do.,that's what they're waiting for you to do.
was nothing criminal.,there was nothing criminal.
"cause realistically, they didn't have to lock me up.","because realistically, they didn't have to lock me up."
i'm gonna talk.,i'm going to talk.
i need to make sure i make out of this situation alive.,i need to make sure i make it out of this situation alive.
i done ha- i've had a few,i've had a few
"instances. i remember, um,","instances. i remember,"
"playing basketball after school at /rd-school-4/, me and my boys,","playing basketball after school at /rd-school-4/, me and my close friends,"
"i'm like, fourteen years old.",i'm about fourteen years old.
"we outside, hey, ha ha we playing.","we're outside, hey, ha ha we're playing."
get out the car.,get out of the car.
"they just come up to me, start questioning me.","they just come up to me, and start questioning me."
oh wait nah my bad.,oh wait no my mistake.
"i ended up- um, i ended up telling my mom.","i ended up-, i ended up telling my mom."
"and, um, i had pulled up,","and, i pulled up,"
"so i get out my car,","so i get out of my car,"
cause,because
"get out the car,","get out of the car,"
"my mom, luckily was like in the kitchen and the kitchen is like right by the door, so she saw the flashing lights.","my mom, luckily was in the kitchen and the kitchen is right by the door, so she saw the flashing lights."
"i didn't do nothing. i'm home. like,","i didn't do anything. i'm home. like,"
"long story short, apparently they stopped me, because the light above my license plate,","to make a long story short, apparently they stopped me, because the light above my license plate,"
they didn't end up giving me a ticket.,in the end they didn't give me a ticket.
they didn't end up doing anything.,in the end they didn't doing anything.
"when i actually ended up getting locked up, i'm like okay, like, you gotta keep your wits about yourself because you know how","when i actually ended up getting locked up, i'm like okay, like, you have to keep your wits about yourself because you know how"
"you need to make it out alive, otherwise your mom's gonna kill you again. (laughing)","you need to make it out alive, otherwise your mom's going to kill you again. (laughing)"
yeah it's-,"yes, it's"
yeah.,yes
"and, um,",and
"part of the people who were like, organizing it, and like was keeping it together","part of the people who were, organizing it, and that was keeping it together"
"and we had a bunch of- we had a bunch of allies who would like link themselves like, around us.","and we had a bunch of- we had a bunch of allies who would link themselves, around us."
"and then you had like- um,","and then you had like-,"
in the inside.,in the inside.
"and like, we had like the men","and, we had the men"
"but i remember like, walking through downtown,","but i remember, walking through downtown,"
"it started off with like,","it started off with,"
then it turned to like a hundred.,then it turned to about a hundred.
"then it's just like,","then it's just,"
"what are you guys marching for? and they seeing the signs, and they're hearing the chants and they're like nah, i feel you. and they","what are you guys marching for? and they see the signs, and they're hearing the chants and they're like no, i understand you. and they"
"park they car and they come and join us. and i'm like, yo like,","park their car and they come and join us. and i'm like, hey,"
and- and,and
"i would probably say we ended up with like,","i would probably say we ended up with,"
"nobody threw a slur, nobody threw a yell, no anything.","nobody threw a slur, nobody yelled, no anything."
"and, um,",and
it could have went completely left.,it could have gone completely wrong.
completely left.,completely wrong.
yeah.,yes
yup.,yes
"yeah,",yes
yup.,yes
"mm-hm. yeah, i don't think i stayed til the end, but i [definitely] came for the","yes, i don't think i stayed until the end, but i [definitely] came for the"
yeah.,yes
"but yeah, i'm like it [went- and] it went","but yes, i'm like it [went- and] it went"
[yeah.],yes
"[but yeah,]",but yes
[yeah.],yes
"every city has a ugly side, but","every city has an ugly side, but"
"my city to be prosperous and really understanding that like, again,","my city to be prosperous and really understanding that, again,"
"i don't really know how to feel because a lot of gentrification been going on, lowkey.","i don't really know how to feel because a lot of gentrification has been going on, without being noticed."
"they trying to like, make it kind of like a touristy type place.","they're trying to, make it kind of a touristy type place."
cause,because
downtown has been barren for a bit.,downtown has been barren for awhile.
"so like,","so,"
"but at the same it's like,","but at the same time it's like,"
yeah.,yes
yeah.,yes
before i turn off the recorder. yeah? [okay.],before i turn off the recorder. yes? [okay.]
[yeah.],yes
always have to ask at the beginning [/and the/ end.],i always have to ask at the beginning [/and the/ end.]
"um, i really appreciate you taking the time out to talk to me.",i really appreciate you taking the time out to talk to me.
"yeah,",yes
"oh wait, /i had it-/ she was so proper, so you saying i'm not proper?","oh wait. i get it, she was so proper. so you're saying i'm not proper."
he- he is like that. i try to leave him from time to time.,"he is that way. ocassionally, i try to get away from him."
but you still with him?,"yet, you are still with him."
[cause you stayed.],because you decided to stay with him.
[you loyal.],"you are loyal./ you, loyal?"
"so do you- stable and loyal, are those the same?",does being stable and loyal mean the same thing to you?
no.,no
mm. i won't go there.,i prefer not to go there.
"like bleach,",similar to bleach.
"real bleach,",authentic bleach?
"with the blue,",are you referring to the bleach sold in the container with the blue label?
that you bought.,so it's a bleach that you have bought?
"not the one that you buy, like",is one that you often buy?
clorox.,clorox.
"clorox, the real bleach.","yes clorox ,the good quality bleach."
"and you buy that,",so you buy clorox.
that's the real thing. you believe in that it kills right?,so clorox is the real deal. do you beiieve it kills germs?
the germs and all [that you- you-],i believe it kills germs and more.
"[oh, okay. the germs.]","oh, okay, it kills the germs and all."
"clorox is your /bland-/ brand, when you say bleach",clorox is your preferred brand.
you mean clorox right? so you're not gonna go buy the little- other kind of stuff they have like for a dollar.,so you're not going to buy cheaper brands?
"cause the clorox whether it's for washing or cleaning, whatever",prefer clorox whether it's for washing or cleaning.
your mother's that way even with her toilet tissue.,your mother is that way even with her toilet tissue.
"scotts well /i think-/ you switching now aren't you? okay scotts,","scott's tissue. are you going to switch now? okay, scott's brand it is."
"but if they didn't do the things that you might consider as little or beneath you,",you might consider them beneath you if they do not do things the way you do.
"gonna be there, whatever, loyalty.",i got your back.
"me, i'm saying, like where i work at, my boss, like i should be loyal.","for example, at work. should i be loyal to my boss?"
"to some people, that you are going to","towards some people, you are going to be."
"/how could i say/,",how should i say?
hot cheese so to speak.,hot cheese for example.
"and so loyalty now, like, the last two years, i never thought of it this way.","for the past two years, i never thought of loyalty this way."
[we] do. and it's sa- well i don't know about cut the ties. i [think you should always],i am not sure about cutting ties.
